{
  "schema_version": 1,
  "contract_version": "1.0.0",
  "source_issue": "PenniLogic/docs#64",
  "consumer_plan_id": "T-UXR-06",
  "artifact_statuses": ["draft", "in_review", "blocked", "approved", "reopened", "superseded", "archived"],
  "cdo_equivalent_scopes": ["D2", "D6", "D8", "shared_system_major", "material_exception"],
  "reopen_on": ["contract", "user_visible_policy", "information_architecture", "component_major", "critical_acceptance", "artifact_version", "evidence", "blocking_comment", "approval_expiry", "role_revocation"],
  "roles": [
    {"id": "product_owner", "responsibility": "basiltt remains the actual accountable product owner; delegated decisions are attributed, not new human appointments."},
    {"id": "decision_coordinator", "responsibility": "Root exercises the delegated CDO-equivalent scopes only; no claim of a human CDO, legal qualification or additional vote."},
    {"id": "design_ops", "responsibility": "Design governance, exclusive ownership, topology, queues, immutable decisions and archive integrity."},
    {"id": "research", "responsibility": "Research methods, synthesis limitations and accept/revise/decline/defer dispositions; no participant contact without operational start evidence."},
    {"id": "service_design", "responsibility": "Personas, jobs, journeys, service blueprints and canonical information architecture."},
    {"id": "android_design", "responsibility": "Android flows, screens, prototypes and platform fidelity."},
    {"id": "web_design", "responsibility": "Customer-web flows, screens, prototypes and responsive behavior."},
    {"id": "admin_design", "responsibility": "Operator flows, screens, prototypes and role-aware safety."},
    {"id": "systems", "responsibility": "Foundations, tokens, shared components and additive library releases."},
    {"id": "content", "responsibility": "Terminology, source copy, regulated-copy routing and localization."},
    {"id": "accessibility", "responsibility": "Accessibility evidence, inclusive design and independent acceptance; cannot waive safety invariants."},
    {"id": "ux_engineering", "responsibility": "Versioned handoff, component mapping, assets and design-to-code contracts."},
    {"id": "design_qa", "responsibility": "Independent critique, prototype evidence, conformance and design QA; never own-author verification."},
    {"id": "engineering", "responsibility": "Implementation feasibility and build conformance; engineering governance remains in DELIVERY.md."},
    {"id": "privacy", "responsibility": "Independent data minimization, access, sharing, retention and research privacy review."},
    {"id": "security", "responsibility": "Independent abuse, authorization and security review; technical delegation is not security acceptance."},
    {"id": "legal", "responsibility": "Qualified legal review when required by research or regulated copy. Unassigned; an AI role label is not counsel, consent or licensed advice."},
    {"id": "research_store_owner", "responsibility": "Controlled research-store ownership, access inventory, offboarding, retention and deletion evidence. Unassigned until an actual store and accountable context are verified."},
    {"id": "release", "responsibility": "Independent release-evidence verification; no deployment or publishing authority is created here."}
  ],
  "artifact_classes": [
    {"id": "product_truth", "includes": "Problem, boundaries, constraints and outcome measures", "responsible": ["product_owner"], "accountable": "product_owner", "consulted": ["research", "security"], "informed": ["design_ops"], "verifiers": ["design_qa"]},
    {"id": "design_governance", "includes": "D18, RACI, topology, queues, decision log and exceptions", "responsible": ["design_ops"], "accountable": "design_ops", "consulted": ["decision_coordinator", "privacy", "security"], "informed": ["product_owner"], "verifiers": ["design_qa"]},
    {"id": "research_plan", "includes": "Ethics, recruitment, consent protocol and methods; not participant records", "responsible": ["research"], "accountable": "research", "consulted": ["legal", "accessibility", "research_store_owner"], "informed": ["design_ops"], "verifiers": ["privacy"]},
    {"id": "research_synthesis", "includes": "Redacted nonparticipant findings, limitations and research dispositions", "responsible": ["research"], "accountable": "research", "consulted": ["service_design", "accessibility"], "informed": ["product_owner"], "verifiers": ["privacy"]},
    {"id": "research_access", "includes": "Controlled-store inventory, access grants, retention and offboarding evidence", "responsible": ["research_store_owner"], "accountable": "research_store_owner", "consulted": ["research", "legal", "security"], "informed": ["design_ops"], "verifiers": ["privacy"]},
    {"id": "personas_jobs", "includes": "Personas, JTBD and mental models", "responsible": ["research", "service_design"], "accountable": "service_design", "consulted": ["product_owner"], "informed": ["design_ops"], "verifiers": ["design_qa"]},
    {"id": "journeys_blueprints", "includes": "Journeys, service blueprints and platform allocation", "responsible": ["service_design"], "accountable": "service_design", "consulted": ["android_design", "web_design", "admin_design"], "informed": ["product_owner"], "verifiers": ["research"]},
    {"id": "sitemaps", "includes": "Canonical routes, navigation and information architecture", "responsible": ["service_design"], "accountable": "service_design", "consulted": ["android_design", "web_design", "admin_design", "accessibility"], "informed": ["design_ops"], "verifiers": ["design_qa"]},
    {"id": "visual_direction", "includes": "Concept alternatives and durable visual/interaction thesis", "responsible": ["systems", "content"], "accountable": "decision_coordinator", "consulted": ["android_design", "web_design", "admin_design"], "informed": ["product_owner"], "verifiers": ["accessibility"]},
    {"id": "foundations_tokens", "includes": "Semantic tokens, assets, typography, motion and primitives", "responsible": ["systems"], "accountable": "systems", "consulted": ["content", "ux_engineering"], "informed": ["design_ops"], "verifiers": ["accessibility"]},
    {"id": "components", "includes": "Component APIs, variants, documentation and library releases", "responsible": ["systems"], "accountable": "systems", "consulted": ["android_design", "web_design", "admin_design", "ux_engineering"], "informed": ["design_ops"], "verifiers": ["design_qa"]},
    {"id": "android_experience", "includes": "Android flows, wireflows, screens, states and prototypes", "responsible": ["android_design"], "accountable": "android_design", "consulted": ["content", "accessibility", "engineering"], "informed": ["design_ops"], "verifiers": ["design_qa"]},
    {"id": "web_experience", "includes": "Web flows, wireflows, screens, states and prototypes", "responsible": ["web_design"], "accountable": "web_design", "consulted": ["content", "accessibility", "engineering"], "informed": ["design_ops"], "verifiers": ["design_qa"]},
    {"id": "admin_experience", "includes": "Admin flows, wireflows, screens, states and prototypes", "responsible": ["admin_design"], "accountable": "admin_design", "consulted": ["content", "security", "engineering"], "informed": ["design_ops"], "verifiers": ["design_qa"]},
    {"id": "content_localization", "includes": "Glossary, source copy, disclosures, localization and content workflow", "responsible": ["content"], "accountable": "content", "consulted": ["legal", "privacy"], "informed": ["design_ops"], "verifiers": ["accessibility"]},
    {"id": "accessibility_evidence", "includes": "Accessibility audits, assistive-technology and inclusive-design findings", "responsible": ["accessibility"], "accountable": "accessibility", "consulted": ["research"], "informed": ["design_ops"], "verifiers": ["design_qa"]},
    {"id": "prototype_validation", "includes": "Heuristics, usability, comprehension and prototype test evidence", "responsible": ["research"], "accountable": "research", "consulted": ["android_design", "web_design", "admin_design"], "informed": ["design_ops"], "verifiers": ["accessibility"]},
    {"id": "handoff", "includes": "Versioned assets, component/state/API/test/telemetry mapping and limitations", "responsible": ["ux_engineering"], "accountable": "ux_engineering", "consulted": ["android_design", "web_design", "admin_design", "engineering"], "informed": ["design_ops"], "verifiers": ["design_qa"]},
    {"id": "readiness", "includes": "Cross-platform D6 evidence aggregation", "responsible": ["design_ops", "ux_engineering"], "accountable": "decision_coordinator", "consulted": ["product_owner"], "informed": ["engineering"], "verifiers": ["design_qa"]},
    {"id": "build_conformance", "includes": "Design-to-code comparison, parity and deviations", "responsible": ["engineering", "ux_engineering"], "accountable": "engineering", "consulted": ["android_design", "web_design", "admin_design"], "informed": ["design_ops"], "verifiers": ["design_qa"]},
    {"id": "release_design_qa", "includes": "Device/browser/operator UAT, localization and release snapshots", "responsible": ["design_qa"], "accountable": "decision_coordinator", "consulted": ["privacy", "security", "accessibility"], "informed": ["product_owner"], "verifiers": ["release"]},
    {"id": "outcome_review", "includes": "Aggregate task metrics, redacted support synthesis and design-debt decisions", "responsible": ["product_owner", "research"], "accountable": "product_owner", "consulted": ["service_design"], "informed": ["design_ops"], "verifiers": ["design_qa"]},
    {"id": "traceability_registry", "includes": "Persona/journey/flow/screen/state/component/diagram/test references", "responsible": ["design_ops"], "accountable": "design_ops", "consulted": ["ux_engineering", "service_design"], "informed": ["engineering"], "verifiers": ["design_qa"]},